{
  "authority": false,
  "project_id": "jaywisdom-boardroom",
  "operator_identity": "jsonwisdom",
  "command": [
    "gcloud",
    "compute",
    "instances",
    "list",
    "--format=json"
  ],
  "evidence": {
    "note": "Seed fixture for Phase 2 read-only GCP audit."
  },
  "checksum": "sha256:aaaaaaaaaaaaaaaaaaaaaaaaaaaaaaaaaaaaaaaaaaaaaaaaaaaaaaaaaaaaaaaa",
  "observed_at": "2026-07-08T00:00:00Z",
  "classifications": [
    "GCP_READONLY_AUDIT_SEED"
  ]
}
